{
  "event_id": "88888888-8888-4888-8888-888888888888",
  "event_type": "subscription.activated.v1",
  "schema_version": 1,
  "occurred_at": "2026-07-17T01:02:03Z",
  "producer": "subscription-service",
  "correlation_id": "44444444-4444-4444-8444-444444444444",
  "causation_id": "55555555-5555-4555-8555-555555555555",
  "aggregate_type": "subscription",
  "aggregate_id": "99999999-9999-4999-8999-999999999999",
  "aggregate_sequence": 1,
  "partition_key": "user:33333333-3333-4333-8333-333333333333",
  "data": {
    "subscription_id": "99999999-9999-4999-8999-999999999999",
    "user_id": "33333333-3333-4333-8333-333333333333",
    "period_id": "aaaaaaaa-aaaa-4aaa-8aaa-aaaaaaaaaaaa",
    "source_order_id": "22222222-2222-4222-8222-222222222222",
    "source_payment_id": "11111111-1111-4111-8111-111111111111",
    "period_start": "2026-07-17T01:02:03Z",
    "period_end": "2026-08-16T01:02:03Z",
    "grace_ends_at": "2026-08-17T01:02:03Z"
  }
}
