{"event_id":"14141414-1414-4414-8414-141414141414","event_type":"subscription.grace.started.v1","schema_version":1,"occurred_at":"2026-08-16T01:02:03Z","producer":"subscription-service","correlation_id":"14141414-1414-4414-8414-141414141414","causation_id":null,"aggregate_type":"subscription","aggregate_id":"99999999-9999-4999-8999-999999999999","aggregate_sequence":3,"partition_key":"user:33333333-3333-4333-8333-333333333333","data":{"subscription_id":"99999999-9999-4999-8999-999999999999","user_id":"33333333-3333-4333-8333-333333333333","period_end":"2026-08-16T01:02:03Z","grace_ends_at":"2026-08-17T01:02:03Z","effective_at":"2026-08-16T01:02:03Z"}}
